Region,Website,Partners,ProjectDescription,ProjectLead,Country,StartTime,EndTime,Status,Budget,FundingSource,ProjectLength,Activities,CO2_Source,CCU_Tecnology_Category,Facility stage,Start_TRL,End_TRL,Info On Utilization,CO2_Capture_Utilization,Production_Volume,Product_Categories,Specific_Products_C,Specific_Products_A,Specific_Products_B,Specific_Products_D,Specific_Products_E,Specific_Products_F,Specific_Products_G,Specific_Products_H,Specific_Products_I,"
' Chemicals


Specific Product(s)",Specific_Products_K,Specific_Products_L,Specific_Products_M,Specific_Products_N,Specific_Products_O,Specific_Products_P,ProjectName
Europe,http://www.fz-juelich.de/ibg/ibg-2/DE/Projekte/_bund/optimAL/_node.html,Helmholtz,"Optimized algae for the sustainable production of fuel for the aviation. Algae breeding technologies are developed and the genetic diversity of algae is used to improve production performance in different photobioreactor designs with the help of targeted modification (1) and directed evolution (2). The provision of fundamentals (OptimAL) is linked to sustainable production and conversion to the industrial production of biokerosene (AUFWIND). OptimAL focuses on developing innovative ways in the essential first step, the optimized production of algae biomass. AUFWIND evaluates the entire chain from algae biomass production to kerosene v.a. based on today's systems.

",Forschungszentrum Jülich,Germany,2014-01-02,2017-08-31,Completed,1300000.0,N.A.,1337.0,"Technology Infractructure (CCU), Research (CCU), Life cycle assessment (LCA)",Not specified (CO2 from highly concentrated sources of CO2 near generation without (temporary) release to the atmosphere),Utilization,,,4,Biological conversion,,,Fuels,,kerosine,,,,,,,,,,,,,,,OptimAL
Europe,https://co2-utilization.net/uploads/Book_of_Abstracts_BMBF_final_conference_02.pdf,"Evonik/Creavis, Bayer, Likat","The objective of the OrgKoKat project was to find ways of using carbon dioxide as an alternative, sustainable C1 source for high value-add industrial products. The main emphasis is on development of highly active and selective organo catalyst systems for chemical fixation of CO2.

",Leibniz-Institut für Katalyse e.V (LIKAT),Germany,2012-01-05,2015-12-31,Completed,0.0,BMBF,1456.0,"Technology Infractructure (CCU), Life cycle assessment (LCA)",N.A.,Utilization,,,3,Chemical conversion,,,Technology infrastructure (Utilization),,,,Chemicals and katalysts for chemical fixation of CO2,,,,,,,,,,,,,OrgKoKAT
Europe,https://www.kopernikus-projekte.de/en/projects/p2x,"Areva H2Gen GmbH, ArgeNetz GmbH & Co. KG (in German), Audi, BASF SE, Berlin Social Science Center (WZB), BUND, Center for Solar Energy and Hydrogen Research BadenWürttemberg (ZSW), Chemieanlagenbau Chemnitz GmbH, Clariant, Climeworks, Covestro, Dechema e.V., Dechema Forschungsinstitut, ERC Additiv GmbH, Evonik Creavis GmbH, Ford Germany (in German), Fraunhofer Institute for Mechanics of Materials (IWM), Fraunhofer Institute for Solar Energy Systems ISE, Friedrich Alexander Universität Erlangen/Nürnberg, German Aerospace Center, German Institute for Economic Research (DIW), GETEC green energy AG, GETEC heat & power AG, Greenerity GmbH, HelmholtzZentrum Berlin, Heraeus GmbH, Hydrogenious Technologies GmbH, Ineratec, Innogy SE, Institute for Energy and Environmental Research (ifeu), KIT  Karlsruhe Institute of Technology, Leibniz Institute for Catalysis (LiKAT), LudwigMaximiliansUniversität München, OMV, Shell Global Solutions GmbH, Sunfire, TU München, The Linde group, thyssenkrupp, TU Bergakademie Freiberg, VW, Wacker, Wuppertal Institut, WWF Deutschland, ZAE Bayern","The goal of the Kopernikus project P2X is to store renewable energy in physical substances. Accordingly, the project researches possibilities for converting electricity into chemical energy. The renewable energy stored in this way can then be used in high-emissions sectors such as transport and industry, or even for heating for industrial processes, making them more environmentally friendly.

",Institut für Technikfolgenabschätzung und Systemanalyse (ITAS),Germany,2019-01-09,2022-08-31,Completed,10.0,30% BMBF,1330.0,"Hydrogen production, CCU (PowertoX)",Atmospheric CO2 or industrial flue gasses (not specified),Capture (DAC and Point Sources) and Utilization,,,7,"Thermal conversion, Electrochemical conversion, Chemical conversion",up to 0.5 - 10 kg/hr (fuels); 10 m3/h SNG,,Fuels,,,,"Syngas, Liquid fuels (hydrocarbons and oxymethylene ethers, liquidfied natural gas), hydrogen, syngas and CO2-based polymers, Polyol",,,,,,,,,,,,,P2X Kopernikus project
Europe,https://www.p2x-europe.com/news/detail/the-navigator-company-and-p2x-europe-announce-a-unique-joint-venture-in-portugal-to-produce-green-non-fossil-synthetic-efuels-and-scale-up-power-to-liquid-business/,"P2XEurope, Navigator","The Navigator Company and Hamburg-based developer P2X-Europe have decided, subject
to the approval of the relevant anti-trust authorities, to create a unique and powerful joint venture, P2X-
Portugal, to develop a world-class production facility for industrial-scale production of non-fossil jet fuels or e-SAFs (e-Sustainable Aviation Fuels) – carbon-neutral synthetic kerosene, based on green hydrogen and biogenic CO2

",Navigator,,2022-07-01,,Ongoing,,,,,Pulp and paper industry,Capture (Point sources) and Utilization,Planning,8,8,Thermal conversion,280000 t/y of CO2 at full capacity,80000 t/y fuels,Fuels,,"kerosene, jet-fuel",,,,,,,,,,,,,,,P2X-Portugal
Europe,https://www.topsoe.com/processes/ammonia/carbon-dioxide-recovery,"Cemtec fonden, EnergiMidt, Ea Energieanalyse, PlanEnergi, Danish Gas Technology Center, Xergi, Eniig, Naturgas Fyn, HMN Naturgas, Aarhus University","Small demonstration plant for the catalytic methanisation of the CO2 content in the biogas by hydrogen generated from steam in a SOEC (Solid Oxide Electrolyser Cells)-plant. Located at the Agricultural Research Centre of Aarhus University.  The feasibility was investigated by means of engineering studies, energy system integration and economic scenario analyses and performance of a few critical experiments with SOEC cells. The outcome endeavoured to provide answers to the following questions: 1) What is the most cost effective upgrading route: Co electrolysis of the CO2 in the biogas with steam followed by methanation or steam electrolysis followed by methanation of CO2 in the biogas? 2) Can the steam reforming activity be controlled by sulphur without sacrificing to much electrochemical activity or lifetime of the cells?

",Haldor Topsoe,Denmark,2013-06-01,2017-12-01,Completed,5300000.0,EUDP grant program of the Danish Energy Agency,1644.0,"Technoeconomic analysis, CCU (PowertoX), Applicability assessment",Biogas,Utilization,,,7,Electrochemical conversion,5.87 kg/hUnit is designed to yield 10Nm³/h of biomethane,607 kg/h methane,Fuels,,Methane (96% pure),,,,,,,,,,,,,,,Part of project 'EI upgraded biogas'
Europe,https://co2-utilization.net/en/projects/electro-and-photocatalysis/phaskat/,"Forschungszentrum Jülich GmbH, Evonik Creavis GmbH, Evonik Resource Efficiency GmbH, Siemens Gas and Power GmbH","Phaskat: phase-pure electrocatalysts and adjustment of conditions regarding the reduction of CO2. The aim of the PhasKat project is to develop design rules for the catalysts used in the electrochemical reduction of carbon dioxide into value-added products. By making use of renewable energy valuable products are produced out of the waste carbon dioxide and fed back into the economic industrial cycle. Target products, comprising two coupled carbon atoms, such as ethylene and ethanol, have the potential to provide the chemical industry a sustainable raw material basis, and/or enable the manufacturing of fuels with an annual volume of several hundred million tons.

",Siemens Gas and Power GmbH,,2020-01-02,2023-01-31,Ongoing,581000.0,BMBF,1125.0,"Technology Infractructure (CCU), Research (CCU), CCU",N.A.,Utilization,,,,"Electrochemical conversion, Catalytic conversion",,,Technology infrastructure (Utilization),,,,Catalyst development for the electrochemical reduction of CO2 into ethylene and ethanol.,,,,,,,,,,,,,Phaskat
Europe,http://www.photofuel.eu/home.php,"Syncom, Centro Ricerche Fiat, Volvo, Karlsruhe Institut für Technologie, Neste, IFPEN, AlgaFuel, Niversita Firenze, Imperial College London, Universität Bielefeld, Uppsale untiversitet, Volkswagen","The overall objectives  are: 1) Make a significant contribution to the biocatalytic production development of solar fuels (from TRL 3 to TRL 4-5). This by enabling cyanobacteria or phototrophic algae  to produce alcohols and alkanes, which can be harvested from the culture broth due to their excretion by these microorganisms, 2) Assess the broad impact of this novel approach to fuel composition (also taking into account other emerging waste- and residue based fuels) and engine performance in the future.

",Volkswagen AG,,2015-01-05,2019-04-30,Completed,6000000.0,100% H2020,1576.0,"Research (CCU), CCU, Business case development",Atmospheric CO2,Utilization,,3,5,"Photochemical conversion, Biological conversion",,,Fuels,,Alcohols and Alkanes,,,,,,,,,,,,,,,Photofuel
Europe,https://co2-utilization.net/uploads/Book_of_Abstracts_BMBF_final_conference_02.pdf,"LeibnizInstitut für Katalyse e.V, Ruhr Universität Bochum","The goal of the research project is to find ways of reducing atmospheric CO2 by using sunlight in a selective photocatalytic reaction to recycle CO2, producing the C1-building block products methanol and methane. The researchers are working on the development of catalyst systems which are based on semiconducting oxide composites and have high photon yields. The catalysts need to be durable, readily available and suitable for industrial-scale applications. The preferred starting materials are TiO2 and ZnO which are tested in various catalyst systems with varying structures and compositions.

",Leibniz-Institut für Katalyse e.V (LIKAT),Germany,2010-01-10,2016-03-31,Completed,0.0,BMBF,2272.0,"Technology Infractructure (CCU), Research (CCU)",Atmospheric CO2,Utilization,,,3,"Photochemical conversion, Biological conversion",,,Technology infrastructure (Utilization),,,,,,,,Methanol and methane and katalysts for photochemical reduction of CO2,,,,,,,,,PhotoKat
Europe,https://www.energiesystem-forschung.de/forschen/projekte/plasmafuel,,"Development of a new plasma-based process for the production of non-polluting marine diesel; Sub-project: Development of the plasma reactor. uring the ""Power-to-fuel"" project ""PlasmaFuel"", a method to produce CO2-neutral and extremely pure fuel for shipping applications is developed. The synthetic fuel is produced from CO2 sources like exhausts from the cement industry, and uses renewable electric excess energy from wind and solar power plants in order to produce hydrogen and generate the final fuel product on base of a so-called Fischer-Tropsch synthesis.

",Overspeed gmbh,,2018-01-11,2021-10-31,Ongoing,1186676.0,BMWi,1389.0,CCU (PowertoX),Cement production,Utilization,,,5,Other,,,Fuels,,Diesel,,,,,,,,,,,,,,,PlasmaFuel
Europe,https://powertomethanolantwerp.com/,"Participatie Maatschappij Vlaanderen, Oiltanking, Fluxys, INEOS, Indaver, ENGIE, Port of Antwerp","The Power to Methanol project in Antwerp will produce methanol from captured CO2 combined with hydrogen that has been sustainably generated from renewable electricity. Currently, methanol is largely produced using fossil-based raw materials, which emits carbon dioxide from the process. With this innovative project, for each tonne of methanol produced at least one tonne of CO2 emissions would be avoided. The 7 strong consortium comprises leading industrial and business partners: ENGIE, Fluxys, Indaver, INOVYN, Oiltanking, Participate maatshappij Vlaanderen (PMV) and Port of Antwerp. Future development could see increased volumes of sustainable methanol produced for wider industry use, including as a sustainable fuel for marine and road transport.

",Port of Antwerp,Belgium,2020-05-07,,Ongoing,,,,,WastetoEnergy,Capture (Point sources) and Utilization,Planning,7,7,Catalytic conversion,,8000 t/a,"Chemicals, Fuels",,Methanol,,,,,,,,,,,,,,,Powerfuel
Europe,https://www.iet.hsr.ch/index.php?id=13510&L=4,"Audi, KTI, HeStorage (Swiss competence centers for Energy Research), Energie ZürichseelLinth, Erdgas, EWJR, Climeworks","A power-to-methane system wich an efficiency of that reached 35% was demonstrated.  The electricity for the pilot plant was produced with a photovoltaic system. The required hydrogen was produced by electrolysis and the carbon dioxide was recovered directly from ambient air using a Climeworks filter system. The chemical feedstock was converted by catalytic reaction to methane. The power-to-methane plant was also connected to the local gas grid, so the methane could be fed into this grid.

",Institut für energietechnik,Switzerland,2014-01-01,2017-01-01,Completed,0.0,SNSF,1096.0,CCU (PowertoX),Atmospheric CO2,Capture (DAC) and Utilization,,,7,Catalytic conversion,,,Fuels,,Methane,,,,,,,,,,,,,,,Power-to-methane
Europe,https://www.enargus.de/pub/bscw.cgi/?op=enargus.eps2&q=%2201182835%22,"Ineratec, Karlsruhe Institute of Technology (KIT), Bauhaus Luftfahrt, German Aerospace Centre, Siemens Gas and Power, Climeworks, Technical University of Hamburg","Demonstration and potential analysis of new technologies for sector coupling for the production of synthetic fuel from carbon dioxide.

",Hamburg University of Technology,,2018-01-12,2021-11-30,Ongoing,2109938.0,BMWI,1418.0,"Technoeconomic analysis, CCU (PowertoX)",Atmospheric CO2,Capture (DAC) and Utilization,,,6,"Thermal conversion, Chemical conversion",,200-300 l/d,Fuels,,Jet Fuel (Kerosene),,,,,,,,,,,,,,,Power to Methanol Antwerp B.V.
Europe,https://prisma.hw.ac.uk/,"UC Berkley, Sintef, EPFL, HWU","Our aim is to accelerate the transition of energy and industrial sectors to a low-carbon economy by developing a technology platform to tailor-make cost-efficient carbon capture solutions for a range of different CO2 sources and CO2 use/destinations. More specifically this project will look deeper in to sorbent based CO2 capture.

",HWU,,2019-01-01,2022-01-01,Ongoing,2100000.0,H2020 (ACT),1096.0,"Research (CCU), Environmental assessment, CCU",Coal/NG power generation/industrial sources/waste incineration/biogas/atmospheric CO2,Capture (Point sources),,1,3,,,,Captured CO2Specific Product(s):,,,,,,,,,,,,,,,,,PrISMa
Europe,https://co2-utilization.net/en/projects/electro-and-photocatalysis/prodigy/,"Sondervermögen Großforschung beim Karlsruher Institut für Technologie (KIT), HelmholtzZentrum Berlin für Materialien und Energie GmbH (HZB), Technische Universität Berlin (TUB), Carl von Ossietzky Universität Oldenburg, LeibnizInstitut für Katalyse","The use of CO2 to produce fine chemicals and fuels offers an excellent solution to combat global warming and the energy crisis at the same time. Solutions for this problem are searched intensively worldwide. In “PRODIGY”, the partners produce (nano) materials which, as so-called photocatalysts, can convert CO2 into useful products in an environmentally friendly manner using sunlight. This “artificial photosynthesis” is not an easy process, since CO2 is an extremely stable and unreactive molecule. Products of interest are higher-value products, such as lower alcohols, aldehydes, or carboxylic acids.

",Leibniz-Institut für Katalyse,,,,Ongoing,0.0,BMBF,,"Research (CCU), Life cycle assessment (LCA), CCU",N.A.,Utilization,,,,Photochemical conversion,,,Chemicals,,"lower alcohols, aldehydes, or carboxylic acids",,,,,,,,,,,,,,,Prodigy
Europe,http://www.projectair.se/en/,"Uniper, Fortum, Perstorp","Project Air is an industrial initiative to transform the chemical industry towards climate neutrality, with far-reaching effects throughout industrial value chains. Perstorp Group and partners Fortum and Uniper will produce sustainable methanol for chemical manufacturing using circular production methods, thereby reducing carbon dioxide emissions by 500,000 tons per year, corresponding to the annual emissions of around 340,000 new cars running on fossil fuel

",Perstorp,Sweden,2019-01-01,,Ongoing,230000000.0,40% Innovation Fund,,CCU,"Chemical refinery, Biogas plant",Capture (Point sources) and Utilization,Planning,8,9,Thermal conversion,,200000 t/y methanol at full capacity,"Chemicals, Fuels",,methanol,,,,,,,,,,,,,,,Project AIR
Europe,https://co2-utilization.net/en/projects/chemical-and-biotechnological-reduction-of-co2/promet/,"Covestro, RheinischWestfälische TechnischeHochschule Aachen, Universität Clausthal, RuhrUniversität Bochum, Deutsches Zentrum für Luft und Raumfahrt e. V., Air Liquide Forschung und Entwicklung GmbH, Fumatech BWT GmbH","The ProMet-Project aims at the development of a direct synthesis route of Methanol from CO2 by electrolysis. In the Methanol-to-Propylene process, Methanol is the raw material for the production of Propylene, an important basic chemical with an annual worldwide production of 100 Mio tons. Using electricity from renewable sources for the electrochemical conversion of CO2 allows for a more sustainable production of both Methanol and Propylene.

",Covestro,,2020-01-01,2023-01-31,Ongoing,0.0,BMBF,1126.0,"Technoeconomic analysis, Life cycle assessment (LCA), Environmental assessment, CCU",N.A.,Utilization,,,,Electrochemical conversion,,,Chemicals,,Methanol and propylene,,,,,,,,,,,,,,,ProMet
Europe,http://www.pyroco2.eu/,"VESTFOLD OG TELEMARK FYLKESKOMMUNE, ECOINNOVAZIONE SRL, NEXTCHEM SPA, RANIDO, SRO, JOHNSON MATTHEY PLC, SCG CHEMICALS COMPANY LIMITED, Norner Research AS, BIOPROCESS TECHNOLOGY SL, CHALMERS TEKNISKA HOGSKOLA AB, HEROYA INDUSTRIPARK AS, NORCE NORWEGIAN RESEARCH CENTRE AS, FIRMENICH SA, AXELERA  ASSOCIATION CHIMIEENVIRONNEMENT LYON ET RHONEALPES, CIAOTECH Srl, KARLSRUHER INSTITUT FUER TECHNOLOGIE, CENTRE NATIONAL DE LA RECHERCHE SCIENTIFIQUE CNRS, ARKEMA FRANCE SA , DANMARKS TEKNISKE UNIVERSITET, LUABIO APS, SINTEF AS","Twenty leading industrial and research partners from 11 countries have teamed up to prove that large-scale conversion of industrial carbon emissions into value-added chemicals and materials is possible. As a game changer for European carbon-intensive industries, the EU-funded PYROCO2 project will pave the way for the sustainability of Europe’s chemical industry. It will demonstrate the scalability and economic viability of carbon capture and utilisation to generate climate-positive acetone from industrial CO2 and renewable electricity-derived hydrogen. The project will demonstrate that the acetone produced is an ideal platform for the catalytic synthesis of a range of chemicals, synthetic fuels and recyclable polymer materials from CO2 for viable business cases and pre-developed processes for replication and commercialisation.

",SINTEF AS,Norway,2021-10-01,2026-09-30,Ongoing,43887818.0,91% H2020,1825.0,"Value chain demonstration, CCU",,Capture (Point sources) and Utilization,Planning,6,7,Biological conversion,9100 t/y CO2,4000 t/y acetone,Chemicals,,acetone,,,,,,,,,,,,,,,PyroCO2
Europe,http://www.carboncentric.no/rakkestad?lang=en,"Slaattland Mekaniske, KANFA , Carbon Centric, Ostfold Energi","A full-scale carbon capture facility will shortly be assembled at the district heating plant of Rakkestad in Eastern Norway. The CO2 capture project is modular based and the first of its kind to be tested for waste incineration.

",Ostfold Energi,Norway,2021-11-01,,Ongoing,,,,,WastetoEnergy plant,Capture (Point sources),Under Construction,7,7,,10000 t/y CO2,,Captured CO2Specific Product(s):,,,,,,,,,,,,,,,,,Rakkestad
Europe,http://www.realiseccus.eu,"SK Innovation Co., Ltd, Dunhua Petroleum technology Co., Ltd , TSINGHUA UNIVERSITY, CYBERNETICA AS, BORD GAIS ENERGY LIMITED, ELECTRICITY SUPPLY BOARD , IRVING OIL WHITEGATE REFINERY LIMITED, UNION ENGINEERING AS, EQUINOR ENERGY AS, POLITECNICO DI MILANO, UNIVERSITY COLLEGE CORK  NATIONAL UNIVERSITY OF IRELAND, CORK, THE UNIVERSITY OF EDINBURGH , BIOBE AS , ERVIA, NORGES TEKNISKNATURVITENSKAPELIGE UNIVERSITET NTNU , NEDERLANDSE ORGANISATIE VOOR TOEGEPAST NATUURWETENSCHAPPELIJK ONDERZOEK TNO , SINTEF AS","Almost everyone now agrees that we should decrease the amount of atmospheric carbon dioxide (CO2) to mitigate climate change. Reducing CO2 production is not the only way to reduce emissions. Carbon capture, use and storage (CCUS) refers to an integrated set of technologies to prevent the CO2 produced during the combustion of fossil fuels from entering the atmosphere. Currently, these technologies focus on the greatest sources of CO2 in a process, ignoring smaller ones. The EU-funded REALISE project is developing a way to capture up to 90 % of CO2 from multiple sources in operating refineries at a cost that is 30 % lower than existing capture methods. The project will include the evaluation of the entire CCUS chain from emitter to storage as well as socio-political aspects and social readiness assessments based on three business cases in the EU and China

",SINTEF AS,Ireland,2020-05-01,2023-10-31,Ongoing,7131752.0,90% H2020,1278.0,,Oil refinery,Capture (Point sources),Planning,6,7,,25 kg/d captured CO2,,Captured CO2Specific Product(s):,,,,,,,,,,,,,,,,,REALISE
Europe,https://www.recodeh2020.eu,"Titan Cement Company AE, Uab Modernios eTechnologijos, Centre for Research and TechnologyHellas (CERTH), Fondazione Istituto Italiano di Tecnologia (IIT), Deutscher Verein des Gas und Wasserfaches, M.T.M. SRL, Rijksuniversiteit groningen, European Research Institute of Catalysis A.I.S.B.L., Politecnico di Torino, Karlsruher Institut für Technologie, IoLiTecIonic Liquids Technologies GmbH, Avantium, HySyTech","This project works on: (i) Capture and conversion of the CO2 in the flue gases from TITAN (cement factory in Greece) - 25 vol% CO2, (ii) CO2 purification, (iii) Production of value added chemicals that can be used as cement additives (nanoCaCO3, formic acid, oxalic acid, glycine), (iv) Integration w/ low cost renewable electricity from low grad heat based electricity power

",Istituto Italiano di Tecnologia,Greece,2017-08-01,2021-07-31,Completed,7904415.0,100% H2020,1460.0,CCU,Cement production,Capture (Point sources) and Utilization,,4,6,Electrochemical conversion,,,Chemicals,,,,,,,,,,,,,,,"Cement additives: NanoCaCO3, formic acid, oxalic acid, glycine",,Recode
Europe,https://cordis.europa.eu/project/id/289253,"Kungliga Tekniska hoekskolan, EPEAInternationale Umweltforschung gmbh, Technische Universitaet Graz, The University of Nottingham, Universitaet fuel bodenkultur Wien, Technische Universiteit Eindhoven, Sprin SPA, Eidgenoessische Materialpruefungs und forschungsanstalt, DSM Ahead BV, Croda International Plc., Dublin City University","REFINE: REnewable FunctIoNal matErial.  REFINE will develop sustainable, green routes to functional materials for various polymer/plastic applications to lower the reliance of petrochemical products. An integrated approach of combining green raw materials, green synthesis (biotechnology) and green processing is applied.  Except for lipase and cutinase enzymes, REFINE focusses on designing and optimising new enzymes to synthesise and modify polymers through biotechnology. Furthermore, green reaction solvents such as supercritical CO2 and ionic liquids are investigated as polymerisation and processing media in addition to green polymer additives.

",Dublin City University,Ireland,2012-01-01,2015-12-31,Completed,4139304.99,EU (FP7-People),1460.0,"Research (CCU), Life cycle assessment (LCA), CCU",N.A.,Utilization,Project Completed,,,"Polymerization, Biological conversion",,,Polymers,,"Polymers, plastics",,,,,,,,,,,,,,,REFINE
Europe,"https://www.repsol.com/en/sustainability/circular-economy/our-projects/synthetic-fuels/index.cshtml


News Highlights:
- https://matthey.com/hycogen-ft-cans-aramco-repsol","Johnson Matthey, Saudi Aramco, Repsol, Energy Agency of the Basque Government (EVE), Petronor","The repsol decarbonisation project will produice the largest net zero emissions synthetic fuel production plant in the world, based on green hydrogen generated with renewable energy. The main feature of these new fuels is that they are produced using water and CO2 as the only raw materials. They can be used in the combustion engines that are currently installed in automobiles in Spain and the rest of the world, as well as in airplanes, trucks, and other machinery.

",Repsol,Spain,2019-01-12,,Ongoing,60000000.0,N.A.,,CCU (PowertoX),Petronor Refinery,Capture (DAC and Point Sources) and Utilization,Under Construction,,8,"Thermal conversion, Reverse water gas shift (RWGS)",6.7,2100 t/y by 2024,Fuels,,synthetic fuels,,,,,,,,,,,,,,,Repsol decarbonisation project
Europe,https://www.reuze.eu/,"ArcelorMittal, INFINIUM, ENGIE","The ‘Reuze’ project will convert more than 300,000 tons of carbon dioxide waste annually into e-fuels for shipping and aviation in Europe

",ENGIE,France,2022-02-01,,Upcoming,,,,,Steel industry,Capture (Point sources) and Utilization,Planning,,9,Thermal conversion,300 kt/a captured CO2,,,Fuels & chemicals,,,,,,,,,,,,,,,,Reuze
