Region,Website,Partners,ProjectDescription,ProjectLead,Country,StartTime,EndTime,Status,Budget,FundingSource,ProjectLength,Activities,CO2_Source,CCU_Tecnology_Category,Facility stage,Start_TRL,End_TRL,Info On Utilization,CO2_Capture_Utilization,Production_Volume,Product_Categories,Specific_Products_C,Specific_Products_A,Specific_Products_B,Specific_Products_D,Specific_Products_E,Specific_Products_F,Specific_Products_G,Specific_Products_H,Specific_Products_I,"
' Chemicals


Specific Product(s)",Specific_Products_K,Specific_Products_L,Specific_Products_M,Specific_Products_N,Specific_Products_O,Specific_Products_P,ProjectName
Europe,http://cordis.europa.eu/project/id/838031,"TOTAL, AMAL, BREVIK, CMI, Axens, UETIKON, Gassco, ACP, IFPEN, Danmarks Tekniske Universitet (DTU), RheinischWestfälische Technische Hogeschool (RWTH Aachen Universit)","This project aims mainly at demonstrating DMXTM CO2 Capture technology in AMAL’s Dunkirk (FR) steel mill on an industrial pilot plant. Waste Heat Recovery well combined with DMXTM process will allow reaching unprecedent CO2 Capture cost under 40 €/tCO2.  Downstream requirements and environmental, societal and stakeholder’s expectations are dealt from the beginning and all-along the project. Moreover, DMXB solvent production will be optimised industrially and environmentally, through LCA.

",IFPEN,France,2019-05-01,2023-04-30,Ongoing,19239368.51,76% H2020,1460.0,"Life cycle assessment (LCA), CCU",Steel production,Capture (Point sources),Planning,5,7,,,0.5t CO2/h,Captured CO2Specific Product(s):,,,,,,,,,,,,,,,,,3D-Project DMX
Europe,http://www.4aircraft-project.eu/,"UNIVERSIDADE DE SAO PAULO, UNIVERSITEIT ANTWERPEN , AGENCIA ESTATAL CONSEJO SUPERIOR DE INVESTIGACIONES CIENTIFICAS, UNIVERSITA DEGLI STUDI DI TORINO, FUNDACION BCMATERIALS  BASQUE CENTRE FOR MATERIALS, APPLICATIONS AND NANOSTRUCTURES, UNIVERSITAET BIELEFELD, HELSINGIN YLIOPISTO, KOKURITSU DAIGAKU HOJIN HOKKAIDO DAIGAKU , FUNDACION PARA EL DESARROLLO DE LAS NUEVAS TECNOLOGIAS DEL HIDROGENO EN ARAGON","The global aviation sector has set a course towards meeting the climate objectives of the Paris Agreement. In this context, the EU-funded 4AirCRAFT project will develop the next generation of stable and selective catalysts for the direct CO2 conversion into liquid fuels for the aviation industry. The project will integrate three main reactions into one, allowing the production of sustainable jet fuel at low temperatures. This advanced technology will decrease greenhouse gas emissions and restrict dependence on fossil fuel-based resources. The project will integrate and exploit biocatalysts, inorganic nanocatalysts, electrocatalysts, and their controlled spatial distribution within application tuned catalyst carrier structures that are based on metal-organic frameworks and engineered inorganic scaffolds with hierarchical porosity distribution.

",FUNDACION PARA EL DESARROLLO DE LAS NUEVAS TECNOLOGIAS DEL HIDROGENO EN ARAGON,Spain,2021-05-01,2024-04-30,Ongoing,2897153.0,77% H2020,1095.0,,,Utilization,Planning,2,3,Catalytic conversion,,,Fuels,,"synthetic kerosene, jet-fuel",,,,,,,,,,,,,,,4AirCRAFT
Europe,http://www.abacus-bbi.eu/,"Sensient Cosmetic Technologies, MICROPHYT, Proteus, Subitec , Spanish National Research Council (CSIC), The Karlsruhe Institute of Technology (KIT), A4F  Algae for Future, SAMS, Alternative Energies and Atomic Energy Commission (CEA)","This business-oriented project aims at a new algal biorefinery, thereby bringing to the market innovative algae-based ingredients for high-end applications. These include algal terpenes for fragrances and long-chain terpenoids (carotenoids) for nutraceuticals and cosmetic actives. For this, cultivation steps, production of targetproducts and unique algae strains coming from 4 large culture collections owned by project’s partners are selected and optimised.

",Alternative Energies and Atomic Energy Commission (CEA),France,2017-01-05,2020-07-31,Completed,5135861.16,91% H2020,1303.0,"Technoeconomic analysis, R&I, Life cycle assessment (LCA), CCU, Applicability assessment",N.A.,Utilization,,,,"Photochemical conversion, Biological conversion",,,Food/Feed,,,Algae based terpenes and long-chain terpenoids (carotenoids) for nutraceuticals and cosmetic actives.,,,,,,,,,,,,,,ABACUS
Europe,http://ac2ocem.eu-projects.de/,"Total, Air Liquide, Norwegian University of Science and Technology (NTNU), LafargeHolcim, HeidelbergCement, TITAN Cement Company S.A., The Centre for Research & Technology, Hellas (CERTH), SINTEF Energy Research, thyssenkrupp, VDZ GmbH, IFK, Universität Stuttgart","In AC2OCem, pilot-scale experiments, as well as analytical studies, will be performed to bring the key components of oxyfuel cement plants to TRL6 with the aim of reducing the time to market of the oxyfuel technology in the cement sector.  1st and 2nd generation oxyfuel technologies are considered.

", University of Stuttgart,Germany,2019-01-10,2022-09-30,Completed,3000000.0,H2020 (ACT),1359.0,"Technoeconomic analysis, CCU",Cement sector,Capture (Point sources),Project Completed,5,6,,,,Captured CO2Specific Product(s):,,,,,,,,,,,,,,,,,AC20CEM
Europe,http://www.projectaccsess.eu/,"TOTALENERGIES ONETECH , PROSPIN SPOLKA Z OGRANICZONA ODPOWIEDZIALNOSCIA, HERIOTWATT UNIVERSITY , CHALMERS TEKNISKA HOGSKOLA AB , FRAUNHOFER GESELLSCHAFT ZUR FORDERUNG DER ANGEWANDTEN FORSCHUNG EV , VDZ TECHNOLOGY GGMBH, EIDGENOESSISCHE TECHNISCHE HOCHSCHULE ZUERICH , VERBAND DER BETREIBER SCHWEIZERISCHER ABFALLVERWERTUNGSANLAGEN RISC ,  TECHNOLOGY CENTRE MONGSTAD , EQUINOR ENERGY AS , HUMBOLDT WEDAG GMBH , LINDE GMBH, NEUSTARK AG, Saipem, HAFSLUND OSLO CELSIO AS, HEIDELBERGCEMENT AG , STORA ENSO AB, SINTEF ENERGI AS","The EU Green Deal aims at transforming the EU into a resource-efficient economy with no net emissions of greenhouse gases by 2050. In this context, the EU-funded ACCSESS consortium will develop replicable carbon capture, utilisation and storage (CCUS) technology to pave the way to a climate-neutral Europe. Specifically, it will reduce emissions and contribute to the production of climate-neutral end products. ACCSESS will provide safe, cost-efficient, flexible and replicable CCUS addressing a range of sectors – from pulp and paper to biorefining. The project will demonstrate cost-efficient CO2 capture and use in industrial facilities.

",SINTEF ENERGI AS,Sweden,2021-05-01,2025-04-30,Ongoing,18427187.0,81% H2020,1460.0,CCU,Paper pulp mill,Capture (Point sources),Planning,6,7,,2 t/d capture,,Captured CO2Specific Product(s):,,,,,,,,,,,,,,,,,Accsess (site 1)
Europe,http://www.projectaccsess.eu/,,"The EU Green Deal aims at transforming the EU into a resource-efficient economy with no net emissions of greenhouse gases by 2050. In this context, the EU-funded ACCSESS consortium will develop replicable carbon capture, utilisation and storage (CCUS) technology to pave the way to a climate-neutral Europe. Specifically, it will reduce emissions and contribute to the production of climate-neutral end products. ACCSESS will provide safe, cost-efficient, flexible and replicable CCUS addressing a range of sectors – from pulp and paper to biorefining. The project will demonstrate cost-efficient CO2 capture and use in industrial facilities.

",SINTEF ENERGI AS,Poland,2021-05-01,2025-04-30,Ongoing,18427187.0,81% H2020,1460.0,CCU,Cement plant,Capture (Point sources),Planning,6,7,,2 t/d capture,,Captured CO2Specific Product(s):,,,,,,,,,,,,,,,,,Accsess (site 2)
Europe,http://www.advancefuel.eu/,"Nederlandse organisatie voor toegepast Natuurwetenschappelijke onderzoek (TNO), AALTO KORKEAKOULUSAATIO SR, Leibniz Institute of Agricultural Engineering and Bioeconomy e.V. (ATB), Greenovate! Europe, Chalmers Tekniska Hoegskola AB, Imperial college of science technology and medicine, Universiteit Utrecht, Stichting Energieonderzoek centrum","ADVANCEFUEL aims at enabling the commercialization of advanced and liquid renewable alternative fuels (RESfuels) from lignocellulosic feedstocks, renewable hydrogen and CO2 streams. This to meet the renewable energy targets set at European level for 2020 and 2030. A systemic approach to address RESfuel market roll-out in road, marine and aviation applications is proposed.

",Fachagentur Nachwachsende Rohstoffe (FNR),Germany,2017-01-09,2020-08-31,Completed,2628246.25,100% H2020,1330.0,"Sustainability assessment, Market penetration assessment, Life cycle assessment (LCA), Implementation strategy, Consulting (CCU), Communication",N.A.,Utilization,,,,,,,Fuels,,"Renewable alcohols, e.g. ethanol, butanol and methanol and renewable diesel, renewable jet fuels, dimethyl ether, as well as liquefied biomethane.",,,,,,,,,,,,,,,ADVANCEFUEL
Europe,http://cordis.europa.eu/project/rcn/101720_en.html,"UFRO, UCV, International Centre for Theoretical Physics (ICTP), IGCSIC, Uantof, UHU, UCV","The main goal of the present joint exchange programme is to determine the feasibility of using sunlight transformation capacity of microalgae to enhance biogas production of anaerobic digestion processes, by means of CO2 capture from biogas and co-digestion of waste and microalgal biomass.  Microalgae biomass produced can be fed to an anaerobic bioreactor, where it is converted to biogas. Subsequently, biogas can be used for energy production. CO2 released can be used for microalgae production, as well as the nutrients released during the anaerobic conversion of the microalgae. Such cycle would be actually driven by sunlight, which provides the energy required to sustain the cycle.

",Consejo Superior de Investigaciones Científicas (CSIC),Spain,2012-01-02,2016-01-31,Completed,709800.0,100% EU (FP7-People),1490.0,CCU,Biogas,Utilization,,,,Biological conversion,,,FuelsSpecific Product(s):,,,,,,,,,,,,,,,,,ALGAENET
Europe,https://act-anica.eu/,"The Centre for Research & Technology, Hellas (CERTH), Calix, Ulster University, Estra, Suez, Lhoist, Dyckerhoff, Thyssenkrupp, VDZ, FriedrichAlexander Universität Erlangen Nürnberg (FAU), Technische Universtiät Darmstadt, CaO Hellas","The overall aim of the project is to develop concepts of the indirectly heated carbonate looping (IHCaL) process for CO2 capture from lime and cement plants. In the carbonator, the CO2 contained in a flue gas is absorbed by CaO, and the CaCO3 formed herby is regenerated in an indirectly heated calciner. The heat for calcination is produced by combustion of fuel with air in an external combustor and transferred to the calciner by means of heat pipes. The flue gas of the external combustor is directed to the carbonator.

",Technische Universität Darmstadt,Germany,2019-01-01,2022-01-01,Ongoing,2400000.0,H2020 (ACT),1096.0,"Technoeconomic analysis, Environmental assessment, CCU",Lime and cement plants,Capture (Point sources),,1,3,,,,,,,,,,,,,,,,,,,,,ANICA
Europe,https://www.audi-technology-portal.de/en/mobility-for-the-future/audi-future-lab-mobility_en/audi-future-energies_en/audi-e-gas_en,"EWE Energie AG, the Fraunhofer Institute for Wind Energy and Energy System Technology (IWES), Centre for Solar Energy and Hydrogen Research (ZSW), SolarFuel GmbH, Sunfire","The Audi e-gas project focusses on methanation of CO2, using electrolysis produced H2. The carbon dioxide originates from biogas.

",Audi,Germany,2013-01-01,,Ongoing,20000000.0,Audi + regional power-supply fund,,CCU (PowertoX),Organic wastebiogas plant,Utilization,Operational,,7,Electrochemical conversion,"2,800 tonnes of CO₂ per year","1,000 tonnes of methane per year",Fuels,,Methane,,,,,,,,,,,,,,,Audi e-gas plant
Europe,"http://www.fz-juelich.de/SharedDocs/Pressemitteilungen/UK/DE/2014/14-05-16aufwind.html


News Highlights:
- https://www.advancedsciencenews.com/take-off-with-kerosene-made-from-algae/","Airbus group, Verfahrenstechnik Schwedt, Verbio Biofuel and Technology, FraunhoferGesellschaft zur Förderung der angewandten Forschung, TU München, RWTH Aachen University, Lausitz University of Applied Sciences, Phytolutions GmbH, Deutsches Biomasseforschungszentrum, Deutsches Biomasseforschungszentrum, EADS Germany, Forschungszentrum Jülich, OMV","Aufwind assesses the capacity of bacterial enzymes for utilizing CO2 as a feedstock for organic chemicals or fuels. Three different commercially available photobioreactor types are constructed adjacent to each other and are evaluted.

",Forschungszentrum Jülich,Germany,2013-01-06,2016-08-31,Completed,7700000.0,BMEL,1333.0,Research (CCU),Power plant (RWE power),Utilization,Completed,,4,Biological conversion,,,Fuels,,Biokerosene,,,,,,,,,,,,,,,AUFWIND
Europe,https://aurora-heu.eu,"EUROQUALITY SAS, CYBERNETICA AS, UMICORE, HERACLES GENERAL CEMENT CO , MOTOR OIL (HELLAS) DIILISTIRIA KORINTHOU A.E. , AKER CARBON CAPTURE NORWAY AS, TOTALENERGIES ONETECH , UNIVERSITA DEGLI STUDI DI ROMA LA SAPIENZA , TECHNOLOGY CENTRE MONGSTAD , NORGES TEKNISKNATURVITENSKAPELIGE UNIVERSITET NTNU, SINTEF AS","Rapid up-scaling and deployment of more cost-efficient and sustainable carbon capture solutions is needed to reduce the emissions of CO2-intensive industries. Solvent-based carbon capture is an important technology that can be readily adopted to many emission sources. Such technology can achieve high capture rates and deliver CO2 at high purity with a relatively low energy demand. In AURORA the open and non-proprietary CESAR1 solvent technology will be optimised and qualified for commercial deployment. The technology will be demonstrated at TRL7-8 for three CO2 intensive industries:  refining, cement, and materials recycling, for which there are few other options to achieve climate neutrality. The partners will demonstrate negligible environmental impact (emissions being a potential issue for solvent technology), capture rates at 98%, and capture costs reduced by at least 47% compared to a benchmark process with the MEA solvent. This will be achieved due to the following innovations: 1) Holistic optimisation of solvent composition, process design, emission monitoring and control, and solvent management, 2) Validated models for use in commercial process simulators 3) enhanced waste heat integration with carbon capture for reduced external heat demand and operational costs 4) Improved and integrated advanced control system for reduced OPEX and optimised performances. These innovations will be integrated in four optimised capture processes and various aspects will be demonstrated in pilots of various size and complexity. The partners will ensure transferability of results to other CO2 intensive industries thanks to the large variations in CO2 source and developed clusters addressed in the project and  a strong stakeholder participation. The project will also do full CCUS chain assessments for its end-users. It is noteworthy that the end-users are situated in two different regions of Europe offering different conditions for the implementation of CCUS value chains.

",SINTEF AS,,2023-01-01,2026-06-30,Ongoing,15734176.0,77% Horizon Europe,1276.0,,"Cement, refinery",Capture (Point sources),Operational,,7,N.A.,,,Captured CO2Specific Product(s):,,,,,,,,,,,,,,,,,AURORA
Europe,http://bactofuel.eu/,VITO,"Bac-to-fuel: BACterial conversion of CO2 and renewable H2 inTO bioFUELs.  This project aims to find new, sustainable alternatives to fossil fuels  (specifically for the European transport sector) by developing, integrating and validating a disruptive prototype system at TRL5 that is able to transform CO2/H2 into added-value products which: 1) mimics the photosynthetic process of plants using novel inorganic photocatalysts which are capable of producing H2 in a renewable way from photocatalytic splitting of H2O in the presence of sunlight, 2) uses enhanced bacterial media to convert CO2 and the renewable H2 into biofuels  using a novel electro-biocatalytic cell that can handle fluctuations in H2 and power supply

",Universidad de santiago de compostela erasmus,,2019-01-01,2021-12-31,Completed,2999922.5,100% H2020,1095.0,"Technology Infractructure (CCU), Life cycle assessment (LCA), CCU",Atmospheric CO2,Utilization,,,5,Biological conversion,,,Fuels,,"Ethanol, butanol",,,,,,,,,,,,,,,Bac-to-Fuel
Europe,http://www.beccu.fi/,"Kleener, Kemianteollisuus ry, Finnfoam Oy, Top Analytica, Pirkanmaan jätehuolto, Metener, Mirka, Neste, Helen Ltd, CarbonReUse, Killto Oy, Valmet, Business Finland, VTT","The main objectives of this project are: i)  Perform proof-of-concept for the integrated production of biopower & heat, transportation fuels and specialty chemicals based on utilization of CO2 from biomass operations and hydrogen from water electrolysis or industrial processes, ii) Create new business opportunities proving ultimate novelty for producing fully CO2-based specialty chemicals such as polycarbonate and polyether polyols. Selected comparative P2X-concepts for CO2 utilization will also be evaluated (e.g. ash-treatment, SNG, methanol), iii) increase the TRL of studied unit processes and the techno-economics of the concept

",Technical Research Centre of Finland (VTT),Finland,2020-01-01,2022-02-28,Ongoing,4835000.0,N.A.,789.0,"Value chain demonstration, Technoeconomic analysis, Research (CCU), Life cycle assessment (LCA), Impact assessment, CCU (PowertoX), Business case development",CO2 from biomass operations,Utilization,,,6,"Reverse water gas shift (RWGS), Polymerization",,,Fuels,,,,"polycarbonate, polyether polyols, methanol",,,,,,,,,,,,,BECCU
Europe,http://energetika.cvut.cz/en/bio-ccs-projekt/,"Czech Academy of Science, Technical University Ostrava, Brno University of Technology, Czech Technical University in Prague (CTU)","The project focusses on research in the field of CO2 capture from combustion processes (CCS-carbon capture and storage) using biomass – so-called Bio-CCS, and also with utilization of the captured CO2 – Bio-CCU.  The research will be specifically focused on oxy-fuel combustion of various sorts of biomass in a fluidized bed, which turns out to be one of the most promising technology, and on its complete technological chain, including production of oxygen. Second major research task is oxy-gasification of biomass and the third key task is utilization of the captured CO2 to produce liquid fuels.

",Czech Technical University in Prague (CTU),Czech Republic,2018-01-01,2022-12-31,Ongoing,0.0,N.A.,1825.0,"Research (CCU), CCU, CCS","Combustion, gasification, fermentation, aerobic digestion",Capture (Point sources) and Utilization,,,6,N.A.,,,Fuels,,Liquid fuel,,,,,,,,,,,,,,,Biocat 3
Europe,https://energiforskning.dk/en/node/9084,"Insero, Neas Energy, HMN, Biofos, Audi, Hydrogenics, Electrochaea","Now, BioCat continues in Biocat 3 which is funded by EUDP. Here, the goal is to achieve full system automation as well as to refine the BioCat techno-economic model for operating the system in the current Danish energy environment. Furthermore, this project period will also serve as a complete evaluation of the BioCat system operating envelope.

",Electrochaea,Denmark,2017-12-31,2020-12-31,Completed,1226603.07,66% EUDP,1096.0,"Technoeconomic analysis, CCU (PowertoX)",Varied,Utilization,Operational,,9,"Catalytic conversion, Biological conversion",,,Fuels,,Methane,,,,,,,,,,,,,,,BioCat Project
Europe,"http://www.electrochaea.com/technology.html 
https://biocat-project.com/about-the-project/","Insero, Neas Energy, HMN, Biofos, Audi, Hydrogenics, Electrochaea","The BioCat Project focused on demonstrating the technical and economic potential of a cutting-edge energy storage technology known as power-to-gas – this project was successfully completed in December 2016. In addition, Electrochaea continues to maintain and operate the BioCat Plant as a demonstration site, which is open for visitors. Inside the bioreactor, a culture of methanogenic archaea metabolizes the hydrogen and carbon dioxide to methane.

",Electrochaea,Denmark,2014-01-02,2016-12-31,Completed,6700000.0,EUDP,1094.0,CCU (PowertoX),"Two sources: raw biogas from adjacent AD (+ 60% CH4, 40% CO2) and a pure CO2 stream from onsite biogas upgrading system",Utilization,Operational,,7,"Catalytic conversion, Biological conversion",,,Fuels,,Methane,,,,,,,,,,,,,,,Bio-CCS/U
Europe,https://biocon-co2.eu/,"DAN*NA, TENALIA, Bio Base Europe Pilot Plant  (BBEU), NESHER, AQUATT, Wageningen Food and Biobased Research  (WFBR), Pervatech, Fraunhofer IME, ArcelorMittal, Engie Laborelec, University of Groningen (RUG), Universitat Autònoma de Barcelona(UAB), Nutrition Sciences, ARTTIC, Aachen Chemical Engineering (AVT.BIOVT), National Technical University of Athens  (NTUA), ARKEMA, LEITAT","BIOtechnological processes based on microbial platforms for the CONversion of CO2 from ironsteel industry into commodities for chemicals and plastics. For this enzymes and micro-organisms , anaerobic microorganisms and aerobic microorganisms, are used.

",Acondicionamiento tarrasense asociación,,2018-01-01,2021-12-31,Completed,6999886.25,100% H2020,1460.0,"Social impact assessment, Social acceptance, Research (CCU), Environmental assessment, CCU, Applicability assessment",Iron and steel industry,Utilization,,,5,"Enzymatic conversion, Biological conversion",,,Chemicals,,"C3-C6 alcohols, 3-hydroxypropionic acid, formic acid, lactic acid",,,,,,,,,,,,,,,BIOCON-CO2
Europe,http://www.bionicoproject.eu/,"ICI caldaie, RKV, JM, QUANTIS, ENC, TECNALIA, Technische Universiteit Eindhoven (TUE), Politecnico di Milano (POLIMI)","Bionico will develop, build and demonstrate a biogas plant with a TRL 6 in which a direct, single-step  conversion of biogas to hydrogen gas is achieved. This results in an increase of volumes and auxiliary heat management units and an overall increase of efficiency. This project is based upon knowledge and experience directly gained in three granted projects: ReforCELL, FERRET and FluidCELL.

",Politecnico Di Milano,Portugal,2015-01-09,2019-12-31,Completed,3396640.0,93% H2020,1817.0,"Technology Infrastructure (H2 production), Life cycle assessment (LCA), Hydrogen production",ENC Landfill plant,N.A.,,,6,,,100 kg H2/day,Fuels,,Hydrogen gas,,,,,,,,,,,,,,,Bionico
Europe,"http://www.biopower2gas.de/partner.html


News Highlights:
- https://www.ieabioenergy.com/wp-content/uploads/2018/02/2-BioPower2Gas_DE_Final.pdf","MicrobEnergy GmbH, CUBE Engineering GmbH, EAM EnergiePlus GmbH, EnergieNetz Mitte GmbH, IdE Institut dezentrale Energietechnologien gemeinnützige GmbH","The power-to gas combination of electrolysis and biological methanation technology represents an essential component for future energy systems, combining decentralised solutions for storage of energy with upgrading of raw biogas. During this project various power controlled biogas technologies have been analyzed, experienced in practice and compared in terms of their capability to generate electricity demand-actuated. For this, a new “BioPower2Gas”-method (methanation of H2 produced with surplus renewable electricity and CO2 from the biogas plant) was installed by the company MicrobEnergy. This method was successfully tested and due to become practice-approved and was tested by three plants.

",IdE Institut dezentrale Energietechnologien GmbH,Germany,2013-01-09,2016-08-31,Completed,0.0,BMWi and Energetische Biomassennutzung,1330.0,CCU (PowertoX),CO2 from biogas,Utilization,Operational,,8,Biological conversion,,,Fuels,,Methane,,,,,,,,,,,,,,,BioPower2Gas (site )
Europe,https://co2-utilization.net/en/projects/chemical-and-biotechnological-reduction-of-co2/bio-ugs/,"DBI Gas und Umwelttechnik GmbH, FriedrichSchillerUniversität Jena, MicroPro GmbH, Isodetect GmbH","The project “Bio-UGS“ investigates the targeted conversion of carbon dioxide and green hydrogen to methane in underground gas storage facilities by using natural existing microorganisms. This shall reduce the dependency from imported fossil carbons, as well as develop a circular economy for CO2 from industrial processes and a storage concept for hydrogen from renewable energies.

",DBI Gas- und Umwelttechnik GmbH,,2020-01-02,2023-12-31,Ongoing,0.0,BMBF,1459.0,"Research (CCU), CCU",N.A.,Utilization,,,,Biological conversion,,,Fuels,,Methane,,,,,,,,,,,,,,,BioPower2Gas (site 1)
Europe,"http://www.biopower2gas.de/partner.html


News Highlights:
- https://www.ieabioenergy.com/wp-content/uploads/2018/02/2-BioPower2Gas_DE_Final.pdf","MicrobEnergy GmbH, CUBE Engineering GmbH, EAM EnergiePlus GmbH, EnergieNetz Mitte GmbH, IdE Institut dezentrale Energietechnologien gemeinnützige GmbH","The power-to gas combination of electrolysis and biological methanation technology represents an essential component for future energy systems, combining decentralised solutions for storage of energy with upgrading of raw biogas. During this project various power controlled biogas technologies have been analyzed, experienced in practice and compared in terms of their capability to generate electricity demand-actuated. For this, a new “BioPower2Gas”-method (methanation of H2 produced with surplus renewable electricity and CO2 from the biogas plant) was installed by the company MicrobEnergy. This method was successfully tested and due to become practice-approved and was tested by three plants.

",IdE Institut dezentrale Energietechnologien GmbH,Germany,2013-01-09,2016-08-31,Completed,0.0,BMWi and Energetische Biomassennutzung,1330.0,CCU (PowertoX),CO2 from biogas,Utilization,Operational,,8,Biological conversion,,Maximum 15 Nm³ biomethane/h.,Fuels,,Methane,,,,,,,,,,,,,,,BioPower2Gas (site 2)
